name,website,email,phone,address,mission_statement,year_founded,popu_served,twitter,facebook,linkedin,instagram,programs,county
92,School District 12 Education Foundation,http://5starfoundation.org/,[email protected],7209724342,"1500 E. 128th Ave., Thornton, CO, 80241","We 'mind the gap' between traditional K-12 education and the outside world.  With the support of our donors and funders, we create links and bridges for Adams12 students and the outside world.  We envision a paradigm shift where students think about 1.  what they want to be THEN 2.  What education do they need to get there and finally, #3.  where do they need to go to get that education.  Through community partnerships we ensure that ALL students see their own path to future success
Mission:  Invest in Student Success
Vision:  The Five Star Education Foundation contributes to the improvement of the overall quality of life in our community through investments in educational services and programs to assist Adams12 students in achieving their full potential.
",1985,"All Populations, Children and Youth, Low Income",,https://www.facebook.com/5StarColorado/,,,"Student Success Incubator Funds:  The Five Star Foundation believes that teachers and students know the pathway to future success.  They just need support and resources.  Student Success Incubator Funds INVEST in these results driven projects designed by students and teachers and walk the path them to TEST, PROVE and SCALE these opportunities.  Last year this program funded $60,000 in unique projects proposed by students and staff.
Youth Advisory Board:  Our board knows that student voices need to be heard at all levels to successfully support their educational needs.  The Youth Advisory Board, while in the initial stages, is bringing students to the table to identify problems in the schools, set direction for solving those issues, make funding decisions, and be part of the strategic planning process with the foundation board.  This program gives real world leadership and decision making experience to a diverse group of students.  The goal is to grow this to student representation from all high schools by the end of the year.
Career Discovery:  Studies show that exposure to career options early in the educational process help them more readily achieve career success.  Working with our business and government partners, we provide programing to immerse students in all aspects of a career field.  They can then take this knowledge and choose educational pathways to their future career.  We are piloting this program with one business partner and are looking to duplicate it in 3 more fields this year targeting low income students.
Career Readiness: For students to be ready for the workforce, they need skills, training on relevant equipment and certifications necessary to succeed in today's job market.  We help students identify WHAT they want to be, what EDUCATION they need to do that and then WHERE they need to go to get that education.  We walk this with them every step of the way.  The program supports the P-TECH (Pathways Early College High School), B-TECH (Business Technology Early College High School) and CTE (Career and Technical Education) programs in the district with equipment, partnerships, and certification funding.  This program is growing to include mentorships, internships and apprenticeships that give ALL students a level playing field.  We are currently serving almost 500 students in these areas and are looking to double this number.
Capacity Building:  There are so many passionate volunteers in the community that are doing amazing things for their local schools and our students. Together with the district, the foundation discovered that there was no central resource nor leader for parent volunteers, teachers and community members to get information and support for their projects.  We fill that need through grant writing workshops, assistance on local school fundraisers and professional support to make sure we are all doing what's best for our student's success.  We currently facilitate $200,000 in funding for individual programs through capacity building.
Learning Readiness:  Extensive studies show that setting students up on the path to success begins with being ready to learn.  This is ensuring students are warm, safe and dry.  It means meeting social/emotional benchmarks to be academically successful.  A portion of our work focuses on making sure the students we serve are READY for the programs we offer.  Some examples of our work are a laundry facility at an alternative high school, social-emotional curriculum for K-5 students at an impacted school and technology to engage students with significant disabilities in a traditional classroom.
",Adams
93,Seawell Ballroom,https://www.denvercenter.org/venue-rentals/,,303-572-4466,"1350 Arapahoe St, Denver, CO, 80204","Align your company with the DCPA when you host your fundraiser in the Seawell Ballroom. Our theatrically-trained team brings your imagination to life. Non-profit discounts available.
",1998,All Populations,,,,,,Denver
94,Second Time Shop,http://www.jld.org,[email protected],303-789-4055,"5042 E HAMPDEN AVE, DENVER, CO, 80222",,,,,,,,,Denver
95,Secular Hub Inc.,https://www.secularhub.org,[email protected],720-583-5222,"PO BOX 2519, Denver, CO, 80201","Secular Hub Inc is organized: 1) for educational, scientific, and charitable endeavors, 2) to provide a physical location to serve as the headquarters and meeting space to enable all secular groups to thrive, 3) to provide our members with a social community that creates camaraderie and resources for personal growth 4) to orchestrate charitable and volunteer community service projects across Colorado to raise the awareness of the secular movement, and 5) to support and promote public policies of the American Humanist Association.
",2011,All Populations,https://twitter.com/secularhub,https://www.facebook.com/SecularHub/,https://www.linkedin.com/company/secular-hub-inc,,"Provide meeting space for secular groups.
Organize secular and science events.
",Denver
96,Seeds of Hope,http://www.seedsofhopedenver.org,[email protected],303-715-3127,"1300 South Steele Street, Denver, CO, 80210","Seeds of Hope cultivates minds and hearts for Christ by striving to make a transformative Catholic education financially accessible to any family who seeks it.
",1996,Children and Youth,http://twitter.com/seedsofhopeden,http://www.facebook.com/seedsofhopedenver,https://www.linkedin.com/company/seedsofhopedenver/,https://www.instagram.com/seedsofhopedenver/,"Tuition assistance, Adopt-a-Student, Evening of Hope, Golf for Hope
",Denver
97,Seicento Baroque Ensemble,http://www.seicentobaroque.org/,,720-301-7747,"P.O. Box 171, Boulder, CO, 80306","To educate, inspire and foster music appreciation on the part of the public through historically informed performance of Baroque chamber music.  The Seicento Baroque Ensemble emphasizes education for singers, instrumentalists, and the public of all ages about the Baroque period in history, in particular its music, composers, compositions and performance practices.
",2011,All Populations,,https://www.facebook.com/Seicento-Baroque-Ensemble-104519586402842/,https://www.linkedin.com/company/seicento-baroque-ensemble,https://www.instagram.com/seicento_baroque_ensemble/ ,"Depending on the size of the venue, attendance at our concerts varies from 100 to over 300 per performance. With this year’s three-concert program and each concert to be performed in three locations, we can expect total attendance to exceed 1,400. Shown below are the three concerts: Colonial Latin America and the New World (October 21-23, 2016), Ein Kind geborn zu Bethlehem: Christmas Music of Praetorius (December 9-11, 2016), and Handel’s Dixit Dominus (March 24-26, 2017).
",Boulder
98,"Senior Housing Options, Inc.",http://www.seniorhousingoptions.org,[email protected],3035954464,"1510 17th Street, Denver, CO, 80202","“Our Mission is to provide residential communities and caring services to enrich the lives of older adults in Colorado.”
",1980,"People Living With Disabilities, Elderly",,https://www.facebook.com/SeniorHousingOptionsColorado/,,https://www.instagram.com/senior_housing_options/,"Housing; Assisted Living
",Denver
99,Senior Support Services,http://www.seniorsupportservices.org,[email protected],303-832-1622,"846 E 18TH AVE, Denver, CO, 80218","Our mission is to make each day better and safer for Denver's hungry and homeless seniors by providing the resources and support they need to lead more self-sufficient and fulfilling lives.
",1976,"People Living With Disabilities, Elderly, People Experiencing Homelessness, Low Income, Veterans",,,,,"Meals, Day Shelter, Case Management, Transportation, Clothing, Health Insurance, Housing, Government Benefits & Referrals
",Denver
100,Seniors' Resource Center,http://www.SRCaging.org,[email protected],303-238-8151,"3227 Chase St, Wheat Ridge, CO, 80212","Seniors’ Resource Center is a community partner providing person-focused, coordinated services to enhance independence, dignity and quality of life.
",1978,"Elderly, Families, Low Income, Rural, Urban, Veterans",https://twitter.com/srcaging,https://www.facebook.com/seniorsresourcecenter,https://www.linkedin.com/company-beta/1285286/,https://www.instagram.com/srcaging/,"Seniors’ Resource Center, a 501(c)(3) non-profit organization, is dedicated to enhancing the independence, dignity and quality of life for seniors in the Metro Denver Area and surrounding communities.  We believe seniors are a vital part of our community. At Seniors’ Resource Center we provide an array of services that enable older adults to remain in their homes and thrive. Services such as in home care and adult daytime programs provide life enriching activities and support both older adults and their caregivers. We help older adults remain independent and engaged.
",Jefferson
101,Sense of Security,http://www.senseofsecurity.org,[email protected],3036693113,"1355 S Colorado Blvd, Denver, CO, 80222","We provide a Sense of Security from financial hardship and enhance the quality of life for Colorado breast cancer patients in treatment.
",2000,"African-American, Asian-American, People Living With Disabilities, Elderly, Gay, Lesbian, Bisexual, Transgender, People Experiencing Homelessness, Immigrants, Latino/Hispanic, Low Income, American Indian/Native American, Rural, Urban, Veterans, Women and Girls",,https://www.facebook.com/SenseSecColorado/#,,,"Sustained financial support for Colorado breast cancer patients during their treatment. Sense of Security pays regular bills like housing, transportation, food and utilities for up to $500 and up to six months during qualified breast cancer treatment.
",Denver
102,Severe Weather Shelter Network,http://www.swshelternetwork.com,[email protected],720-515-9313,"6228 S CARR CT, Littleton, CO, 80123","Severe Weather Shelter Network partners with other community organizations and agencies to provide emergency overnight shelter on life threatening winter nights for individuals living on the streets.
",2014,People Experiencing Homelessness,http://www.twitter.com/ShelterNetwork,https://www.facebook.com/swshelter,,https://www.instagram.com/swshelternetwork,"Emergency shelter, Education and Homeless Awareness
",Jefferson
103,Shadhika,http://www.shadhika.org,[email protected],3034551819,"1031 33rd Street, Suite 172, Denver, CO, 80205","Shadhika provides funding and support to women-led, locally controlled non-profits in India working to empower at-risk girls so that they, and India,  can realize their aspirations for a better future. We break the cycle of poverty and address gender inequality in India by investing in the education, empowerment and economic self-sufficiency of girls.
",2002,"Asian-American, Women and Girls",,https://www.facebook.com/ShadhikaIndia,https://www.linkedin.com/company/shadhika-india,https://www.instagram.com/shadhika_india/,"Grants for women-led NGOs working in India for girls' education, empowerment, and economic self-sufficiency
",Denver
104,Shalom Denver,http://www.shalomdenver.com,,303-623-0251,"2498 W 2ND AVE, DENVER, CO, 80223","Mailing, packaging, fulfillment and assembly services. Employment for people with disabilities.
",,,,,,,,Denver
105,Shiloh House,http://www.shilohhouse.org,[email protected],3039329599,"6400 West Coal Mine Ave., Littleton, CO, 80123","Shiloh House offers nurturing, therapeutic and educational services to empower youth and families to overcome the impact of abuse, neglect and trauma. Through guidance, clinical intervention and advocacy Shiloh House meets the needs of the community while respecting the diversity of youth and families.
",1985,"African-American, Asian-American, Children and Youth, People Living With Disabilities, Families, Gay, Lesbian, Bisexual, Transgender, People Experiencing Homelessness, Latino/Hispanic, Low Income, Men and Boys, American Indian/Native American, Rural, Urban, Women and Girls",,,,,"Outpatient programs
Residential Treatment Center
Day Treatment
After school programming
Community support
Life skills services
Supervised Visitation
",Jefferson
106,Shout Inc.,http://www.shouteffect.org,[email protected],720-987-3222,"1001 Pontiac Street, Denver, CO, 80220","Our mission at Shout is to change school culture by ""normalizing"" differences, reduce bullying, and build understanding around the challenges experienced by differently-abled students.
",1916,Children and Youth,,,,,"We currently have 23 Sammy's Buddy Programs in Colorado and Utah
",Denver
107,Silver Creek Organization for the Performing Arts,https://www.scopanews.org/,[email protected],720-940-8724,"4901 Nelson Road, Longmont, CO, 80503","To aid and encourage excellence in Silver Creek High School students in Longmont, Colorado, interested in the Performing Arts.  This includes but is not limited to Choir, Band, Orchestra, Drama/Musical Theatre, Debate/Forensics, and Music and Video Technology.
",2006,Children and Youth,,https://www.facebook.com/groups/273654993006685,,,"Fundraising, grants, scholarships and promotional activities
",Boulder
108,Sister Carmen Community Center,http://www.sistercarmen.org,[email protected],303-665-4342,"655 ASPEN RIDGE DR, Lafayette, CO, 80026","The mission of the Sister Carmen Community Center is to provide assistance to residents of East Boulder County who are in need, without discrimination.
",1976,All Populations,,,,,"Nutrition and Healthy Living
Individual and Family Advocacy
Family and Community Education
",Boulder
109,Sisters of St. Francis,http://www.FranciscanWay.org,[email protected],303-458-6270,"5314 Columbine Rd., Denver, CO, 80221","Awake to the transforming love of God throughout creation, we compassionately serve all as sister and brother by our contemplation, presence, forgiveness, hope, and joy.
",1939,All Populations,,,,,"Spirituality, prayer, education, social and pastoral services
",Denver
110,Smart Fit Girls,https://smartfitgirls.org/,[email protected],916-300-0307,"1965 Raven View Rd., Fort Collins, CO, 80521","The mission of SFG is to empower middle school girls to support one another and themselves in their pursuit of strength, both in body and mind. We do this using an evidence based program that involves lessons designed to foster self-love and activities that show the girls what they can do when their bodies are strong. We envision a world where girls love all of who they are (inside and out) because we know that all girls are inherently strong, worthy and capable of greatness.
",2015,"Children and Youth, Women and Girls",,https://www.facebook.com/Smart-Fit-Girls-862017540544166/,https://www.linkedin.com/company/smart-fit-girls,https://www.instagram.com/smartfitgirls/,"After-school program for middle school girls
In-school alternative PE program for middle school girls
1 week summer camp for middle school girls
Virtual/Online program for middle school girls
",Larimer
111,SOAR - Seeing Our Adolescents Rise,https://www.soarcolorado.org,[email protected],7206757761,"PO Box 461496, Aurora, CO, 80015","To encourage young adults to invest in their future, helping them to become responsible and motivated advocates for their life.
",2012,"African-American, Asian-American, Children and Youth, Families, Immigrants, Latino/Hispanic, Low Income, Men and Boys, Rural, Urban, Women and Girls",https://mobile.twitter.com/SOARCOLORADO,https://m.facebook.com/soarcolorado/,https://www.linkedin.com/mwlite/company/soar---seeing-our-adolescents-rise,https://instagram.com/soarcolorado?utm_source=ig_profile_share&igshid=cd21mr07t1dg,"The SOAR program encompasses three levels of commitment to help youth be successful in their future. 
Participation in Reflective Wellness therapy allows our youth to delve deeper into issues and concerns they are having personally and socially. Offering the youth and families we work with several modes of therapy to meet the mental health and emotional needs.  This includes individual, family, group, equine, canine, EMDR, DBT, Trauma-focused, and substance abuse therapies, along with mindfulness techniques.
Connecting youth with an advisor who acts as a mentor, tutor or connection to necessary resources assists in growing confidence while building a pathway toward future endeavors, goals, and positive outcomes.  Focusing on youths’ educational needs in order to streamline their current goals in school with their future goals as they mature.  We focus on college preparation, job-shadowing and life skills education. 
Tutoring efforts meet our youth where they are currently at with their educational needs. We act as a liaison between the youth and the school, connecting and collaborating with school professionals who can positively impact the youth's needs during school hours. This allows us to bridge the gap between what is happening at school and how we can effectively work with them outside of the school setting.
Engagement in the community helps broaden a youth’s prospective on life, and more specifically their life. Linking youth to pro social activities creates a hands-on learning environment that promotes advancement, inquisition, desire, and hope.  Within these concepts, youth are also developing life skills and preparation for their future.
The combination of these services helps provide our youth with a well-rounded team focused on their success with the utilization of a strength-based, holistic approach.
",Arapahoe
112,Social Venture Partners Boulder County,http://www.socialventurepartners.org/boulder-county/,[email protected],3038400165,"3701 Arapahoe Avenue #C117, Boulder, CO, 80303","The mission of Social Venture Partners Boulder County (SVP) is to harness the collective power of nonprofits and philanthropic changemakers to accelerate community impact
",2012,All Populations,,,,,"Catapult- investments of pro-bono consulting, coaching and supporting cash grants
Execs Evolve - executive coaching for nonprofit directors
Invested Leaders - facilitated peer-learning for nonprofit directors
Boards with Brains - governance workshops for Board members
Partners - connection-building, education and engagement for philanthropic changemakers
",Boulder
113,Social Venture Partners Denver,https://svpdenver.org/,[email protected],(720) 855-0501,"789 N. Sherman Street #250, Denver, CO, 80203","SVP Denver cultivates effective philanthropists, impact driven funders and skilled volunteers to strengthen social impact organizations, and invest in collaborative solutions – building a powerful ecosystem to tackle our communities' social challenges.
We connect those who want to open their networks and give their time and money to give all residents in our city, regardless of income, race or socio-economic status the ability to meet their basic needs and access opportunities to improve the quality of their lives and participate in an equitable, inclusive economy.
",2002,All Populations,https://twitter.com/SVPDENVER,https://www.facebook.com/SVPDenverhttps://www.facebook.com/SVPDenver,https://www.linkedin.com/company/social-venture-partners-denver,,"Engaged philanthropy
Capacity building for nonprofits
Impact investing
Pro-bono consulting
",Denver
114,"Society of Economic Geologists, Inc.",http://www.segweb.org,,720-981-7882,"7811 Shaffer Parkway, Littleton, CO, 80127","To advance the science of geology and its application to mining and other industries; to disseminate knowledge concerning such application; to advance the status of the profession of geology; and to protect and
",1920,,,,,,,Jefferson
115,"Society of St Vincent de Paul, Denver Metro Council",http://www.svdpden.org,[email protected],303-960-9163,"558 Castle Pines Parkway, Unit B-4 #107, Castle Rock, CO, 80108","A network of friends, inspired by Gospel values, growing in holiness and building a more just world through personal relationships with and service to people in need.
",1878,All Populations,,,,,"We provide utility and rental assistance, food and clothing, ARC store gift cards, motel vouchers, gas cards, loan assistance, legal assistance.
",Douglas
116,Sock it To Em Sock Campaign,http://www.sockittoemsockcampaign.org,[email protected],303-929-0556,"7150 Townsend Dr, Littleton, CO, 80130","To provide new socks to men, women and children who are experiencing homelessness and/or are in need.
",2012,"Children and Youth, People Experiencing Homelessness, Low Income",https://twitter.com/SockItCampaign,https://www.facebook.com/sockcampaign/,,,"Sock Ambassador Volunteer Program
No Socks Sundays (First Sunday in December)
Mayoral Support Proclaiming Sock It To Em Work Day (Second Wednesday in December)
Schools: Sock It To Em Sock-Tober, Toasty-Toes, Crazy Sock Days and Sock Drives
Sock It Out between Denver Police and Denver Sheriffs month of December
Socks and Sandwiches
Cops, Socks and Sandwiches
Sock Drawers in Title One Schools
Socks for Cleats for Kids Program with Denver Bronco Alumni
",Douglas
